Nice place in a quiet neighborhood. Would highly recommend. Host was very helpful in making sure we were comfortable. ,Noise
Overall we enjoyed our stay. The host did mention in the check-in instruction that voices in the hallway carry easily through the windows so I'd encourage any guest to bring ear plugs and eye mask. (We stayed over the mardi gras weekend.) The unit is on 3rd floor in an apt/condo complex with secured gates. Location is very safe and convenient where there are great restaurants and bars within walking distance. Our self check-in was easy and had enough towels to use. We also enjoyed ESPN channels.,Noise
"description of listing is accurate. RIGHT next to the convention center. Everything was great but I would recommend bringing ear plugs if you like to sleep in ""silence"" because you can hear people walking by on the street or outside of the apt. ",Noise
"Perfect downtown location, place was nice if a little basic and unfortunately surroundings were very loud! ",Noise
"No real issues. Place is clean and nice and well-maintained. Easy to access. Great, super convenient location. Parking isn't really an issue, either; plenty available nearby.Only negative thing is that it can be a little loud if it's a holiday / busy weekend in one of the bedrooms, due to the fact that it faces the street. Chalk it up to being near everything. ",Noise
"The check in at Jenny's was very easy. The air conditioning worked very well and the bed was super comfy. It was an easy walk to Downtown Austin. The construction was loud, but Jenny had told us about it. It was quiet at night.",Noise
"The home accurately depicts the images and is aesthetically well designed in a great location in Travis Heights near South Congress, etc. Some quirks and things to note on value - one of the beds was very squeaky so we changed rooms and the beds felt like doubles. The HVAC unit is dated and super loud, which interrupted our sleep each night from constantly turning on at length... We had to raise our voices during conversation in the living room when A/C kicked on. Subjective complaint(s) - there's post-it notes all over the house that need to be pared down, in my opinion, and picked up in a concise one-pager in the welcome handbook if there's a need to nip the bud from on-going guest complaints and or issues inside the home (modern design = intuitive user experience). We felt like kids staying at a friend's house whose overprotective parents watch over us with all the notes and instructions posted everywhere, along with the lingering ""we may see you during your stay"" noted. 3/5",Noise
"The apt is the lower part of a duplex. I don't know if the upper part of the duplex is also an Airbnb rental but I was disturbed by the noise coming from above and in and out of the front door (some young guys who were very loud and slamming the door at 10pm, 2am). I guess you just need to go out a lot! There also seemed to be a lot of car alarms going off in the neighborhood. It is in a fantastic location to 6th street, a park and several shops/restaurants. There was some coffee, 1 Corona and bottle of wine and some chocolate provided which is thoughtful. Not sure if there was cable? There was a guide in folder but no remote? There is Netflix which is awesome. Keyless entry is good but I could not remember 10 digit code code and had to keep my phone on me at all times. Responsive host when I contacted her regarding a leak. Would stay again. Thank you!",Noise
"The apartment building is pretty old and reminds you of dorm rooms but once inside the unit the place is perfect for yourself and a few guests. It's off 6th street which can be loud, especially on weekends. We did have a few issues with the apartment and the host. The place had a strict no smoking policy but smelt like someone has smoked in the unit that morning. After removing the bug we thought we'd be okay. We left the apartment and went out for some food. After that, we found another two bugs in the middle of the night in one of the beds. We ended up getting relocated to another unit down the hall. Upon moving to the new room, we ended up discovering another 5-8 bugs throughout the apartment. Another thing to note, is due to the location of the apartment building, you get a very rowdy and loud crowd. Overall, I would not stay here again for obvious reasons mentioned above. If your looking for a grimey apartment on dirty 6th, this is your spot.",Noise
WONDERFUL stay! Loved her dog so much! ,Other
Bien par rapport au prix pour une ou deux nuits,Other
Good stay,Other
Great stay exactly as seen in pictures... good for quick crash pad ,Other
100 % recommend ,Other
Good place if you're on a budget!,Other
This is a great place to explore downtown Austin.,Other
Easy.,Other
Great place to stay.,Other
Hated my stay,Other
The place was alright,Other
Nothing bad to say about my stay,Other
my stay sucked,Other
don't stay here,Other
d,Other
adsfdsfdsfdsa,Other
This is a neutral comment,Other
Stayed for a convention. Was convenient.,Other
i had a terrible experience here,Other