"Our host did not provide instruction on which room was ours. Upon awkward investigation on our own, we found the previous guest's belongings in our room. Suitcase, items in the closet, items on the nightstand. Our host did not answer our calls or texts in a timely manner to assure us that our accommodations would be made right. A few hours later we heard from Maryam with sincere apologies about the situation. She told us that our bed sheets were being replaced with clean ones. We received a 20% discount for the inconveniences but I think our host is trying to juggle too much. She was going to allow the previous guest to check out late and rely on the guest to change the sheets. It did not work out well. We didn't arrive for check-in until 6pm so it's clear the host was taken advantage of or neither guest nor host can manage their calendars. ",Communication
"BUYER BEWARE this house is listed as an ""entire home"" but there is an older guy that lives upstairs! We were appalled to find someone else walking around in the middle of the night and in the kitchen in the morning considering I was walking around in my sleepwear. Our safety was truly questionable as we had no idea of another guest.Our host was very rude to say the least. She would only communicate with us at 4am and would constantly berate us with convictions and threatened to evict us at 4:30 in the morning because of my service dog. She was very hostile with all her responses and chose to argue with us about the wifi password. It wasn't until the last day of our stay that we received the correct wifi password. We also had trouble with the AC because the man that was staying there turned the air from 69 to 78 every morning around 6AM. ",Communication
"We were disappointed with the communication and cleanliness. We had an average stay, but I would not stay here again. ",Communication
"Great people, great place!",Environment
"Loved this house, with great vibes and very friendly host, who took care of us. ",Environment
"My husband & I stayed in the Green Door condo with my brother and his wife for a long weekend bumming around Austin. Everything about our stay was terrific -- the condo is clean, outfitted with everything you need (dishes, cookware, towels, wifi, space!), and has a great vintage/retro vibe. It's located in a quiet and peaceful residential neighborhoods, but is within walking distance to all the SOCO shops and eateries and an easy drive to everything else in Austin. We were really pleased with our stay -- highly recommended!",Environment
"I really enjoy the boutique hotel experience, and Susan and Anthony have created a space with all the perks of a boutique hotel but with the added advantage of being in a very lovely, quiet neighborhood. I did need to ask some questions/ request something, and the communication was always fast and helpful. My request was accommodated, no problem. I'm not sure a hotel would have done so. Here are some of the things I loved: the Japanese bath (the entire bathroom was sparkly clean), the sheets, the above and beyond comfy mattress, and the supply of ear plugs (I was attending a music fest). The walk around to the apartment reminded me a bit of a spa I've been to in New Mexico, even with the faintest, most relaxing sound of crickets.",Environment
"Susan was an extraordinary host. The house is a beautiful contemporary home in a beautiful, leafy neighborhood filled with gorgeous homes. The unit itself is filled with very nice high-end linens. There are so many lovely touches: decorating, having everything we needed at hand. We have stayed in many Airbnb locations, and Susan's may well be the very best we've experienced.She sent extensive information about restaurants and things to do in Austin before we arrived so we could plan our time. If we return to Austin, we will stay with her again!",Environment
"Indeed, the place is a funky, artsy space that was comfortable, clean and safe. The neighborhood is interesting and Sevylla's place is super close to Onnit Academy/Gym so it's a great place to stay if you're taking a certification course there. Easy access to the freeway and a quick jaunt to all the cool places in the downtown area without being in the hustle and bustle of the city. The neighbors have roosters, so it's a good idea to have ear plugs.",Environment
"The studio is funky and hip, a great place to stay only a short drive from downtown. This place is a Super gem. The neighborhood is very family-friendly so don't expect lots of party noises, although the roosters in the neighborhood might wake you up if you're a light sleeper, so bring some earplugs. Personally I really enjoyed the environment and all of the unique birds (greckles, starlings, roosters and chickens). If you want to take the bus, it goes right by the front door. This was my second visit to Sevylla's Studio and I will definitely be coming back for my next trip to Austin",Environment
Absolutely ADORED this camper! Super cozy and stylish! We had everything we needed and more. Loved seeing the neighbor's cats since they were so friendly. One of my favorite things was the outdoor shower... Try to shower at night if you can to catch a glimpse of the stars :) Would definitely recommend and will be staying again next time I'm in Austin!,Environment
"It's a beautiful, spacious and cozy condo. It is well equipped with the basics such as the washer dryer, dish washer, TV, basic bathroom linen/toiletries etc. Very comfortable place. The building is at a great location! Great food and theaters, groceries etc at walkable distance. Gym and pool and coffee in the lobby are great additions! I had a great time. ",Environment
"Overall, a spectacular experience. The only slight downside was that it was a hike to get into downtown Austin, but certainly not insurmountable with a rental car/uber.The pluses way outweighed the location! The big 2 positives were the airstream itself, and the ridiculous hospitality of the Shannons.The airstream itself was super nice - a blend of vintage style and modern amenities. There's a fridge, dish washer, fully stocked kitchen, TV w/ cable, a big nice bed, a porch with great lighting for evening drinks. Everything was nice and worked well.The hospitality was on the next level. The Shannons left us a bottle of tequila and cocktail ingredients, coffee, cereal, local milk in glass bottles, candy.... Most impressively, on morning one we woke up to a tray left on our front porch with delicious breakfast tacos and OJ. Couldn't have nicer things to say about the Shannons, who felt like old friends who were letting my girlfriend and I stay with them on their property. ",Environment
Our stay at the mansion was great - the property is adorable! I wish we could have stayed longer than just a weekend. ,Environment
A great mix of contemporary and vintage makes this the perfect place to stay in a city like Austin. ,Environment
Cute house! And close to many cool hill country destinations. Great for a weekend stay.,Environment
This tiny house is so cozy and cute! CJ and Katie were so attentive and quick to answer any question! ,Environment
"If you want an amazing Austin experience and only need a small and wonderful place to rest up, this is THE place. Beautiful studio equipped with everything! Amazing skyline atop the 5th floor lounge and outdoor patio! Seconds from the boardwalk! Incredible privacy, efficient check-in/out! A+ all around!!!",Environment
"Comfort: 4/5 This Airbnb was a fairly comfy gem very close to all the action in Austin. The bed was a little hard but absolutely fine for my liking. I had no issue getting sleep, especially with the great temperature and A/C system and the white noise makers. All of the amenities here make you feel right at home at this unique spot in the middle of Austin. Aura: 5/5 If you want a fun, artsy, homish vibe that is symbolic of Austin...look no further. Especially for lone travelers. This place has a great balance of practicality and modern colorful decor. In addition, the inspirational figures and quotes here are pretty awesome too.Other Positives: 5/5 Super unique experience in a great location. Communication was super easy as well as check in. Breakfast bars and a metric ton of Cafe Verona coffee for use. The movie and lounge rooms were sweet and Bill Murray is right there to keep an eye on you. Great airbnb for a great price.",Environment
"While the room was clean... I would not stay here again. I thought I was staying in an Airbnb. I did not realize I was going to be stalked to go through a tour .. which I was not interested in. There is no security features in this building... even less than a hotel. Doors are always open, no security on elevator to get to room and the door to the lounge and pool was always propped open. If you like the hotel atmosphere.. you would probably like this place_not for me.",Environment
"Great great location. But definitely felt a bit unsafe bc we didn't have a locked/secured room, so no security at all of our belongings and renter was a bit sketchy.. I hate to judge but he seemed nervous and kinda Socially weird. Also our room was cluttered with his storage. Would not stay here again",Environment
"We had a great stay at Zen East for South By Southwest! Paddy was extremely accommodating and we found the place to be exotic and homely. It was easy to settle right in and experience Austin, and everything was a short taxi or bus ride away. She had everything we needed for our stay, and we loved the zen vibe of the backyard garden. ",Hospitality
"Very nice, took me to the co-op healthy grocery and gave rides when possible. Has a sweet little dog and a lovely home to share.",Hospitality
"Paddy was very professional but also friendly. The house was lovely, the location was really perfect, and her dog Diego is very cute.",Hospitality
"Paddy's home is charming and she is a very gracious host. She was kind enough to walk me around the neighborhood and make me feel at home.\r\r\r\rAt first I thought the location was a bit far from downtown, but there's a bus route that is a mere 2-blocks from her house and it takes all of 10-minutes to get to The Capital. Biking in the area is great too; it's about a 15-minute bike ride to/from Downtown. Paddy was kind enough to drive me to a bike rental shop.\r\r\r\rThe neighborhood is a bit eclectic with a mixture of Austin locals, artists and activists. I was fortunate to be there the same weekend as East Austin Studio Tours (EAST), which gave me a chance to explore that section of Austin. Paddy & I went to an outdoor performance that was a few blocks from her home, which was fantastic.\r\r\r\rPS: Diego is a cutie.",Hospitality
Paddy couldn't have been a more accommodating host. Her place was comfortable and near the rail line for quick access to downtown. All and all it was a great place to stay.,Hospitality
"I had a very pleasant stay in Austin and Paddy was quite friendly and helpful. She helped me find some places in the neighborhood (which I enjoyed staying in), and her place was like a relaxing oasis. I would definitely stay here again.",Hospitality
"Let me start off by saying that Elizabeth and David are amazing people to get to know, they are very helpful and are great hosts! The area in NW is peaceful, the house is beautiful and cozy and I love the backyard. I will highly recommend my family and friends and anyone to stay with them while visiting Austin. ",Hospitality
I enjoyed my brief stay and hope to visit again-this time longer. They took care of all the little details and I felt very welcomed. ,Hospitality
"Had a great stay. David and Elizabeth are very accommodating and kind. Was not my first stay here, and I would definitely stay again.",Hospitality
"Elizabeth and Dave (and their dog Donny) were AWESOME! They were very friendly and accomodating and they truly made me feel at home. They even invited me to hang out with them and eat dinner with them. (Side note: Elizabeth is an amazing cook!) As for the room, it was very clean and comfortable. The neighborhood was quiet and it wasn't too far from the downtown area. I would definitely stay here again and I would recommend this place to friends and family traveling to the Austin area. The price is right, the location is ideal, and the hosts are amazing. ",Hospitality
"A+++++. This place is even cuter than pictured. Shelley greeted us, showed us around the bungalow, and even took the time to sit down and write out a list of places we could hike around Austin. There were little custom touches all over the bungalow, it was so clean and well-kept, and the small kitchen off the side was adorable and really nice to have. Also VERY central to everything in the city. Couldn't recommend this place more!!!",Hospitality
Nate's home is perfect for staying close to downtown Austin. His place is very clean and comfortable. The room felt just like staying in a hotel with a little refrigerator and coffee machine. He was more than gracious and easy to communicate with. I would definitely recommend his place as it definitely exceeded my expectations. A++,Hospitality
Scout was super dope and gave us great recommendations,Hospitality
Tremendous hospitality. Would stay again.,Hospitality
"DO NOT STAY WITH THIS HOST! TLDR: When we arrived to the Airbnb we found out Carly, the host, put us in a different apartment than the listing which was a much smaller, dirty apartment and tried to deny the switch. Carly is a dishonest host and does not deserve anyone's business. We booked with Airbnb for 8 people and expected to be staying in the same place that was listed. On our way there Carly sent us a different address claiming that the one on Airbnb was incorrect. When we showed up and looked in the new apartment is was obvious it was not the one pictured in the listing AND there was someone in there still cleaning from the previous guests. The entire place was filthy. ",Hospitality
"Joch was a terrible host & I would never deal with him again. First off I was having trouble finding the unit & he never responded to my texts,Airbnb messages, or phone calls. Once I reached the unit I tried reaching him in regards to the TV not working & their being no toilet paper, he never responded. At about 11pm my boyfriend got fed up with him not responding and called him from his number. A woman answered the phone & said she would look for the Apple TV remote. Joch called back several minutes later & said that the last guest must have taken the remote & he would bring the remote along with toilet paper & that he would be their in less than 5 minutes. He never came, in fact he turned off his phone. Upon further inspection of the unit I noticed that throughout the whole bath tub their were these horrible orange stains. The toilet was filthy & their was no toilet paper! The kitchen was beautiful although cooking utensils were very minimal. ",Hospitality
this place sucked! terrible host!,Hospitality
"I would not stay here. This airbnb was notified of my sister staying with me, and they towed her car! It took 3 hrs and $215 to get it back. Barrett was not remorseful whatsoever and did not offer a reimbursement. I also had to call him more than once to actually get him to give my sister her own parking pass! Ridiculous!",Hospitality
"Pros: The apartment is in an excellent location and close to Rainey Street. There is a great bar scene and food truck area right outside. If you are looking for a fun nightlife experience, this is a perfect spot! Cons: The check-in process was a nightmare and very stressful to get things sorted. This Airbnb is manage by a 3rd party company and the communication experience felt very non personal. You have to use an app for the apartment code and another app for parking - not easy! I felt that I was reading a confusing novel to figure out how to check-in. Even though I registered my rental car with the app, I still got towed and this Airbnb wont pay for my $214 towing fee. They couldn't even verify if my rental car was registered upon check-in to avoid any towing mishaps. Overall: I'm not a fan of this Airbnb experience and would look for another Airbnb in Austin next time. Getting towed and having a poor check-in experience was not fun on vacation. ",Hospitality
"Great place, close enough to everything downtown Austin has, yet just far enough to be relaxing and quiet. An excellent place to regroup and recharge. Paddy respected my privacy and different hours. The place is clean and hip - I would stay with Paddy again. You must be okay with dogs. ",Location
"Our top 5 reasons you'll want to stay here and nowhere else: Location - 15 minutes via rental car to downtown, 1 hr 20 min to San Antonio (must make the side trip!) and less than 3 hours from Dallas for ease of flights. Meticulously cleaned and organized in the flat. Everything you need for cooking (small countertop burner), fridge, dishware and more. Folder and guidebook left in the unit for planning activities, and an additional e-mail from Drew with local favorites. Privacy. We would see Drew and Simone in passing, and it felt like saying hello to neighbors. Very comfortable and private entrance into the flat, noise was never an issue.4. Water pressure in the shower. If you travel often, you know how important a good shower is. While slightly tight for two adults, the shower is well built into the private bath off the flat. ",Location
"Erik and Crystal's place is right in the center of downtown Austin, which makes it perfect walking distance to everything. Erik was a great host who's easily contacted and accommodating to all his guests. Could not recommend this place anymore to someone visiting Austin for the first time like myself.",Location
The condo is in a great location.,Location
"We really enjoyed staying here for our recent bachelor party of 8 guys in Austin. It is in a perfect location that is walkable to all of the happening places downtown. It is a clean, modern condo with very convenient access thanks to the key code doorlock. The only negatives were:- This is an 8 person place, not 10. There are 3 king beds and a pull out. I do not have any idea where you sleep 2 more people. - A couple little things like no bathroom vent fans (a big problem with 8 dudes eating BBQ and drinking beer) and the TV not working very well.Overall it was a great place to stay and I would definitely stay there again.",Location
"We were unimpressed with the outside surroundings of the house and cottage. We had to park on the street and then carry your luggage from the street through the gate down the driveway to the back of the house. This wouldn't have been as much of an ordeal had there not been large tree branches limbs and twigs strewn across the driveway. After going to dinner and returning after dark there was no lighting and my husband tripped over this debris trying to navigate back to the cottage. Another issue, although I LOVE dogs, was the large dog that was somewhat intimidating due to barking and jumping onto the window each time we had to walk by the main house. The bed was very comfy too. The only negative inside was the lack of a curtain on a large window that left us having to dress and undress in the bathroom. It was within walking distance to a few wonderful restaurants, which was great. Overall the experience was not great. I do believe just a couple tweaks and it would improve the experience greatly. ",Location
"I'll start with the pros: This space was clean and cute. Plenty of space for a couple (we also had our toddler with us and if you bring a pop-up crib, it should be just fine.) The apartment has it's own entrance and parking space, which was very nice.Now the negatives: The most frustrating part of our experience was the alarm system. We received a very thorough run down of the house via an iphone app provided by the property management company who deals with this listing. But there was no mention of an alarm. When we arrived, we noticed that the alarm would annoyingly beep every time we opened the door. My tech-savvy husband tried to turn that feature off and ended up arming the thing further. When we opened the door again, a crazy loud alarm went off. There was ZERO information with the code to disarm it and when we called the property management, it took them ages to track it down. We ended up getting a visit from the fire department and everything. ",Location
"The location of the apartment is very convenient and closely located to the 6th st, Rainey and Congress. However, the price during the weekend is way to high in comparison to other properties. ",Location
"Alex's place is adequate, though a bit more run-down than the photos indicate. The location is very convenient.",Location
Perfect location-- close to downtown and located in a safe complex. Would highly recommend to others looking for a place to stay while visiting Austin.,Location
"Easy In, Easy Out. No complaints. Great Location. I'd Book It Again.",Location
Within a few miles of everywhere you want to be.,Location
Great spot,Location
Marjorie has a beautiful home that is perfectly located on the edge of town- just close enough to be walking distance from downtown but far enough away to be peaceful. There are also a lot of cute cafes and restaurants right next door. I wish we could have stayed longer. My family and I had a great time.,Location
"Overall this rental was satisfactory. The pictures are accurate, but to call the unit ""luxurious"" is rather optimistic. Furniture is dated and there are no closets for your clothes. Aside from hand soap and a bottle of body wash there were no extra toiletries (not that we required them). The location is ideal with tons of amenities within walking distance. There is no mention that this unit is on the 3rd floor with no elevator. One of the toilets needed fixing as it ran continuously all night. Wifi was both weak and unreliable, and would drop every few minutes. The unit is described as being in a quiet, residential building. That was not our experience. The majority of people we saw in the other units were in their 20s. I fully recognize Sandeep has no control over the other tenants. I included this because if you are intent on a quiet getaway this may not be the ideal unit for you. Overall, the unit was satisfactory. But I would not stay here again, nor would I recommend this unit to a friend.",Location
"Great location for my conference (just across the road). All amenities promised were provided, communication was great and it was a very practical place. If you seek a functional location to base yourself for the city then this is a great option. The accommodation lacks a homey feeling so I would not stay here for a family trip where I would like to spend a lot of time in this apartment.",Location
Pros: price- good for two people on a budget looking for a weekend to explore. Late checkout- we got a message the night before we needed to the check out that we could take our time and check out with ease which was very nice. Well stocked - had lots of extra towels and paper towels for use. And had free water bottles for us and wifi. Also left instructions to not clean up after ourselves. Cons: location- it's about a 26 minute walk on dark side street's to south congress which is where restaurants and happening places are. Biggest complaint is that the street is not well lit so if you are coming home late it will be dark and a bit creepy. Bathroom- very small. My husband felt tight and he 160 lbs and 5'8. There was also a bad smell and a bug fell out of my towel. Overall I would not stay here again but if you are on a budget it's good for a weekend. ,Location
"Ojas is a wonderful host and he has a beautiful property that has been decorated and stocked very thoughtfully to make a guest's stay comfortable. It is a great place if you want to make meals as the kitchen is fully stocked with everything you could want. The location of the house was not great. It is directly across the street from what appeared to be public housing. We checked in after dark and felt uncomfortable with a man that was hanging out at the corner right across from the house. There was also a car parked out in front of the house with it's lights turned on and engine running. It was a very weird situation. We felt so unsafe that we decided to leave for the airport at 5am, several hours before we need to. there was a problem with people ringing the doorbell at midnight on our second night and his response was immediate and he took care of the situation. I feel very bad giving this kind of review, but I did not feel safe and would not stay here again.",Location
David and Elizabeth are nice friendly people and their house is in a nice quiet neighborhood. I enjoyed my stay there and the room was comfortable and clean. ,Noise
Nice home in a quiet neighborhood. Very hospitable. Extremely comfortable bed. Would stay here again.,Noise
The place is as described. The house is in a quiet and safe location. Elizabeth and David were great hosts. She was also very helpful to me during my search for a place to live as I am new to the area.,Noise
"A very nice, well-kept older QUIET neighborhood close to shopping and a Gold's gym, and probably two minutes from 183 (before it becomes toll). There is offstreet parking, which in an older suburban neighborhood with narrow streets is a *real* score.I was warmly welcomed, the room was large with a desk, and there was a large yard with a deck. The A/C is very good, always important in Texas. The closet is large, and there is a microwave in the bedroom, with tea, etc. The shared bathroom was old, but clean, nicely decorated, and very serviceable. THE MATTRESS IS UNCOMFORTABLE. Be aware.There was a dog, but I only saw it when I arrived. It was very quiet the remainder of the time I was in the house.",Noise
